{
  "$schema": "https://json-schema.org/draft/2020-12/schema",
  "$id": "https://structura-reditus.org/schema/author.schema.json",
  "title": "Structura Reditus Research Library — Author Record",
  "description": "Identity record for an author registered in the Research Library. Author identity is stable while contribution history changes. Credentials are provenance metadata with a verification state; they carry no numeric weight.",
  "type": "object",
  "additionalProperties": false,
  "required": ["author_id", "display_name", "status", "registered"],
  "properties": {
    "author_id": {
      "type": "string",
      "pattern": "^AUTH-[0-9]{4}$",
      "description": "Stable author identifier, e.g. AUTH-0001."
    },
    "display_name": {
      "type": "string",
      "minLength": 1,
      "description": "Public display name of the author."
    },
    "orcid": {
      "type": "string",
      "pattern": "^[0-9]{4}-[0-9]{4}-[0-9]{4}-[0-9]{3}[0-9X]$",
      "description": "ORCID iD, if supplied. Never fabricated."
    },
    "status": {
      "type": "string",
      "enum": ["active", "inactive", "retired", "merged"],
      "description": "Registry status of the author identity."
    },
    "registered": {
      "type": "string",
      "format": "date",
      "pattern": "^[0-9]{4}-[0-9]{2}-[0-9]{2}$",
      "description": "ISO 8601 date of first registration (YYYY-MM-DD)."
    },
    "credentials": {
      "type": "array",
      "description": "Optional provenance metadata. Credentials carry a verification state and no numeric weight. Never invented.",
      "items": {
        "type": "object",
        "additionalProperties": false,
        "required": ["statement", "verification_state"],
        "properties": {
          "statement": { "type": "string", "minLength": 1 },
          "verification_state": {
            "type": "string",
            "enum": ["unverified", "self-declared", "externally-verified"]
          }
        }
      }
    },
    "notes": {
      "type": "string",
      "description": "Free-text explanatory notes. Supplements, never replaces, controlled fields."
    }
  }
}
