[
  {
    "author_id": "AUTH-0001",
    "display_name": "Clement Paulus",
    "orcid": "0009-0000-6069-8234",
    "status": "active",
    "registered": "2026-09-13",
    "notes": "First registered author. AUTH-0001 receives the same admission requirements as every future author; no founder exceptions exist. Only the supplied identity fields (display name, ORCID, status) are recorded; no additional credentials, affiliations, roles, or research metadata have been added."
  }
]
